id,source,text,image_path,clean_text
5c6e14ca,Twitter," SHOCK SHIFT in US priorities…  The 2027 US budget draft makes ZERO mention of Ukraine—no weapons, no aid, nothing!   Meanwhile, Donald Trump requests a RECORD $1.5 TRILLION military budget amid war tensions, while cutting domestic spending!",dataset/twitter_images/5c6e14ca.jpg,"SHOCK SHIFT in US priorities… The 2027 US budget draft makes ZERO mention of Ukraine—no weapons, no aid, nothing! Meanwhile, Donald Trump requests a RECORD $1.5 TRILLION military budget amid war tensions, while cutting domestic spending!"
77fedf03,Twitter,"BREAKING : AOC WITH THE NEW WAVE    US representative Alexandria: ""I will oppose all future US military aid to Israel, including funding for systems like Iron Dome.""  ""Netanyahu should finance his own weapons, not by Americans""",dataset/twitter_images/77fedf03.jpg,"BREAKING : AOC WITH THE NEW WAVE US representative Alexandria: ""I will oppose all future US military aid to Israel, including funding for systems like Iron Dome."" ""Netanyahu should finance his own weapons, not by Americans"""
a40944d5,Twitter,"NO MONEY FOR UKRAINE   President’s budget request for FY2027 includes no provision for military, financial, humanitarian aid to Ukraine  The 92-page document does not mention Ukraine with no plans for weapons, funding or support.  #NATO #Israel #TelAviv #Dubai #Trump #Iran",dataset/twitter_images/a40944d5.jpg,"NO MONEY FOR UKRAINE President’s budget request for FY2027 includes no provision for military, financial, humanitarian aid to Ukraine The 92-page document does not mention Ukraine with no plans for weapons, funding or support. #NATO #Israel #TelAviv #Dubai #Trump #Iran"
2e93a7e2,Twitter," No Ukraine funding in US budget  President’s budget request for FY2027 includes no provisions for military, financial, or humanitarian aid to Ukraine  The 92-page document does not mention ‘Ukraine’ once, with no plans for weapons, funding or additional support.",dataset/twitter_images/2e93a7e2.jpg,"No Ukraine funding in US budget President’s budget request for FY2027 includes no provisions for military, financial, or humanitarian aid to Ukraine The 92-page document does not mention ‘Ukraine’ once, with no plans for weapons, funding or additional support."
11ca86ee,Twitter,"No Ukraine funding in US budget  President’s budget request for FY2027 includes no provisions for military, financial, or humanitarian aid to Ukraine  The 92-page document does not mention ‘Ukraine’ once, with no plans for weapons, funding or additional support",dataset/twitter_images/11ca86ee.jpg,"No Ukraine funding in US budget President’s budget request for FY2027 includes no provisions for military, financial, or humanitarian aid to Ukraine The 92-page document does not mention ‘Ukraine’ once, with no plans for weapons, funding or additional support"
847fb196,Twitter,"AOC's statement this week that she would oppose all Israeli military aid, including so-called defensive weapons, is part of a shift from ambitious politicians wanting to gain favor from Democratic voters, writes Nathan Thompson.  https:// prospect.org/2026/04/03/dem ocratic-leaders-shift-away-from-israel-aoc/ …",dataset/twitter_images/847fb196.jpg,"AOC's statement this week that she would oppose all Israeli military aid, including so-called defensive weapons, is part of a shift from ambitious politicians wanting to gain favor from Democratic voters, writes Nathan Thompson. prospect.org/2026/04/03/dem ocratic-leaders-shift-away-from-israel-aoc/ …"
2849278f,Twitter,"Ro Khanna: “We need to say it was a genocide. We need to say there can be no military sales of weapons that kill civilians to Israel. We need to say we’re done with US aid, not a dollar more to Israel, a rich country, a first world country. They can buy for themselves. And we",dataset/twitter_images/2849278f.jpg,"Ro Khanna: “We need to say it was a genocide. We need to say there can be no military sales of weapons that kill civilians to Israel. We need to say we’re done with US aid, not a dollar more to Israel, a rich country, a first world country. They can buy for themselves. And we"
8c899b50,Twitter,"BREAKING:  Trump and Israel dropped bombs on a Red Crescent warehouse in Choghadak, Iran.  Not a military base. Not weapons.  Emergency medical supplies. Humanitarian aid containers. Rescue vehicles.  They’re not just bombing civilians. They’re bombing the ability to save them.",dataset/twitter_images/8c899b50.jpg,"BREAKING: Trump and Israel dropped bombs on a Red Crescent warehouse in Choghadak, Iran. Not a military base. Not weapons. Emergency medical supplies. Humanitarian aid containers. Rescue vehicles. They’re not just bombing civilians. They’re bombing the ability to save them."
70d4f9b9,Twitter,"BREAKING : This is belt treatment to Netanyahu   US representative Alexandria: ""I will oppose all future US military aid to Israel, including funding for systems like Iron Dome.""  ""Netanyahu should finance his own weapons, not by Americans""  Women with METAL SPINE",dataset/twitter_images/70d4f9b9.jpg,"BREAKING : This is belt treatment to Netanyahu US representative Alexandria: ""I will oppose all future US military aid to Israel, including funding for systems like Iron Dome."" ""Netanyahu should finance his own weapons, not by Americans"" Women with METAL SPINE"
91d1ff84,Twitter,Yes a big yes it is enough to see the abysmal debt caused largely by American military aid to Israel and the useless wars against Iraq and the false weapons of mass destruction not found etc...  @usanewshq   @USATODAY   @FoxNews   @CNNPolitics   @CoriBush   @sanchezcastejon   @EmmanuelMacron,dataset/twitter_images/91d1ff84.jpg,Yes a big yes it is enough to see the abysmal debt caused largely by American military aid to Israel and the useless wars against Iraq and the false weapons of mass destruction not found etc...
56b9a2cf,Twitter,"Rep. Alexandria Ocasio-Cortez pledged to vote no on any funding for Israel military aid in Congress, including for so-called “defensive” weapons.  https:// buff.ly/KcGQVAm",dataset/twitter_images/56b9a2cf.jpg,"Rep. Alexandria Ocasio-Cortez pledged to vote no on any funding for Israel military aid in Congress, including for so-called “defensive” weapons. buff.ly/KcGQVAm"
48df8211,Twitter,"The Foreign Assistance Act prohibits sending military aid to countries committing human rights violations. Harris repeatedly promised to violate this law by sending Israel weapons unconditionally. If she believed Palestinians were humans with rights, she'd follow the FAA.",dataset/twitter_images/48df8211.jpg,"The Foreign Assistance Act prohibits sending military aid to countries committing human rights violations. Harris repeatedly promised to violate this law by sending Israel weapons unconditionally. If she believed Palestinians were humans with rights, she'd follow the FAA."
1c676a0f,Twitter,"Also, most Ukraine aid wasn’t even in the form of cash  It was in the form of decommissioned old equipment, expired rockets and ammo that we would recycle and throw away anyway  The $ in the bill was then used to buy OUR US military NEW weapons",dataset/twitter_images/1c676a0f.jpg,"Also, most Ukraine aid wasn’t even in the form of cash It was in the form of decommissioned old equipment, expired rockets and ammo that we would recycle and throw away anyway The $ in the bill was then used to buy OUR US military NEW weapons"
54b25439,Twitter,"Yes,  @conniechansf  should oppose all weapons & military aid to Israel  Pressuring her to do so is important  And I'll NEVER trust what . @saikatc  says about Israel when he bankrolled for MANY years an SF pol who collaborated with the ICE-loving Islamophobic Zionist . @Scotty_Jacobs",dataset/twitter_images/54b25439.jpg,"Yes, should oppose all weapons & military aid to Israel Pressuring her to do so is important And I'll NEVER trust what . says about Israel when he bankrolled for MANY years an SF pol who collaborated with the ICE-loving Islamophobic Zionist ."
9a8ba4d1,Twitter,"Israel has received   In short: Israel received at least $21.7 billion in direct military aid/weapons/defense support from October 2023–September 2025 (on top of the standard ~$3.8B/year baseline), with the surge driven by the conflicts. This is overwhelmingly for weapons",dataset/twitter_images/9a8ba4d1.jpg,"Israel has received In short: Israel received at least $21.7 billion in direct military aid/weapons/defense support from October 2023–September 2025 (on top of the standard ~$3.8B/year baseline), with the surge driven by the conflicts. This is overwhelmingly for weapons"
e62ea0c8,Twitter,"For about the 4th time, Biden did not send “endless hundreds of billions to Ukraine.”  Yes, the military weapons and equipment accomplished something - it kept Ukraine from being decimated.  No, the military aid did not “spike inflation.”",dataset/twitter_images/e62ea0c8.jpg,"For about the 4th time, Biden did not send “endless hundreds of billions to Ukraine.” Yes, the military weapons and equipment accomplished something - it kept Ukraine from being decimated. No, the military aid did not “spike inflation.”"
2b0fd039,Twitter,"Breaking; gas  prices in Israel at the pump   price of gasoline  $2.5 /liter even though it gets billions in aid from America annually & free military equipment, weapons, universal free health care. Diesel $2.8/liter  Americans tax payers money is waisted on zionists  Iran ",dataset/twitter_images/2b0fd039.jpg,"Breaking; gas prices in Israel at the pump price of gasoline $2.5 /liter even though it gets billions in aid from America annually & free military equipment, weapons, universal free health care. Diesel $2.8/liter Americans tax payers money is waisted on zionists Iran"
84ec3d7a,Twitter," BREAKING  Donald Trump has reportedly warned that weapons support for Ukraine could be paused if European nations don’t step up and take part in securing access through the Strait of Hormuz. This move is being seen as a major shift, linking military aid to broader global",dataset/twitter_images/84ec3d7a.jpg,"BREAKING Donald Trump has reportedly warned that weapons support for Ukraine could be paused if European nations don’t step up and take part in securing access through the Strait of Hormuz. This move is being seen as a major shift, linking military aid to broader global"
7b3fc9d5,Twitter,"I know what’s going on here - you’ll keep voting for ‘non-military aid’ to Israel in the billions, and the Israeli government will use that money for its general fund-type needs, freeing up that money to keep buying US-made weapons, right?  That’s what the US did to arm Saddam in",dataset/twitter_images/7b3fc9d5.jpg,"I know what’s going on here - you’ll keep voting for ‘non-military aid’ to Israel in the billions, and the Israeli government will use that money for its general fund-type needs, freeing up that money to keep buying US-made weapons, right? That’s what the US did to arm Saddam in"
b5de6760,Twitter,"Rahm Emanuel says US taxpayers should not ""foot the bill"" for weapons to Israel.  On the Iron Dome, he says ""You're going to pay full price. You don't have special status.""  Comes as AOC says she opposes all military aid to Israel, including so-called defensive weapons.",dataset/twitter_images/b5de6760.jpg,"Rahm Emanuel says US taxpayers should not ""foot the bill"" for weapons to Israel. On the Iron Dome, he says ""You're going to pay full price. You don't have special status."" Comes as AOC says she opposes all military aid to Israel, including so-called defensive weapons."
74532ae4,Twitter,"Americans agree: No weapons for genocide.  Six months ago, opposition to ""military aid to Israel in their war against Hamas"" was -28, with 60% opposed.  This is now a 70-30 issue, where the 30 are diehard Republican bigots.",dataset/twitter_images/74532ae4.jpg,"Americans agree: No weapons for genocide. Six months ago, opposition to ""military aid to Israel in their war against Hamas"" was -28, with 60% opposed. This is now a 70-30 issue, where the 30 are diehard Republican bigots."
14630b2b,Twitter,"Trump threatened to stop supplying  military equipment to NATO's Prioritized Ukraine Requirements List  (PURL) initiative, which procures weapons for Ukraine and is funded by  European nations. Trump threatened to halt Ukraine aid unless Europe joined Hormuz coalition. Initially,",dataset/twitter_images/14630b2b.jpg,"Trump threatened to stop supplying military equipment to NATO's Prioritized Ukraine Requirements List (PURL) initiative, which procures weapons for Ukraine and is funded by European nations. Trump threatened to halt Ukraine aid unless Europe joined Hormuz coalition. Initially,"
1a6fa9c9,Twitter,"Trump-Epstein regime has stopped the military aid to Ukraine. The supply chains have shifted and Ukraine still stands. If Trump-Epstein regime stops selling Ukrainians weapons that's fine, it'll just shift supply chains further but fucks up US arms industry. Go ahead.",dataset/twitter_images/1a6fa9c9.jpg,"Trump-Epstein regime has stopped the military aid to Ukraine. The supply chains have shifted and Ukraine still stands. If Trump-Epstein regime stops selling Ukrainians weapons that's fine, it'll just shift supply chains further but fucks up US arms industry. Go ahead."
deaf1e93,Twitter,"I understand the idea of negotiations by escalations, but even those need some basis. The US stopped Ukraine military aid at the end of 2024, since then, all US weapons have been first bought by the EU, then sent to Ukraine.",dataset/twitter_images/deaf1e93.jpg,"I understand the idea of negotiations by escalations, but even those need some basis. The US stopped Ukraine military aid at the end of 2024, since then, all US weapons have been first bought by the EU, then sent to Ukraine."
83ac22f5,Twitter,"Trump Threatens Ukraine Aid Cut Over Hormuz   President Trump has threatened to halt weapons supplies to Ukraine unless European allies join a ""coalition of the willing"" to reopen the Strait of Hormuz. Citing the Financial Times, reports indicate Trump is leveraging military",dataset/twitter_images/83ac22f5.jpg,"Trump Threatens Ukraine Aid Cut Over Hormuz President Trump has threatened to halt weapons supplies to Ukraine unless European allies join a ""coalition of the willing"" to reopen the Strait of Hormuz. Citing the Financial Times, reports indicate Trump is leveraging military"
1dda245c,Twitter,"Please do at least basic research before stating your opinion. Since 2024, US military aid is close to zero, all provided weapons are purchased by EU and then transferred to Ukraine.",dataset/twitter_images/1dda245c.jpg,"Please do at least basic research before stating your opinion. Since 2024, US military aid is close to zero, all provided weapons are purchased by EU and then transferred to Ukraine."
968a3a3f,Twitter,"Alexandria Ocasio-Cortez (AOC) pledges to vote against all military aid to Israel, including “defensive weapons",dataset/twitter_images/968a3a3f.jpg,"Alexandria Ocasio-Cortez (AOC) pledges to vote against all military aid to Israel, including “defensive weapons"
5a94e4f1,Twitter,Don't underestimate Cuba  some animals of the Cuban regime are dangerous. China  sent them military vehicles within humanitarian aid and they have chemical weapons that they can use against the people of the USA  and especially Miami.,dataset/twitter_images/5a94e4f1.jpg,Don't underestimate Cuba some animals of the Cuban regime are dangerous. China sent them military vehicles within humanitarian aid and they have chemical weapons that they can use against the people of the USA and especially Miami.
d4ebc0b1,Twitter,"U.S. Senator Bernie Sanders is pushing for a Senate vote to block nearly $1 billion in weapons sales to Israel.  His move adds to the ongoing debate in Washington over military aid, foreign policy priorities, and the humanitarian impact of the conflict in Gaza.",dataset/twitter_images/d4ebc0b1.jpg,"U.S. Senator Bernie Sanders is pushing for a Senate vote to block nearly $1 billion in weapons sales to Israel. His move adds to the ongoing debate in Washington over military aid, foreign policy priorities, and the humanitarian impact of the conflict in Gaza."
afa857e8,Twitter,"The “aid” has been utilized in fighting Russia.   The more important question is…  Why are you still buddies with Putin, while they are giving Iran critical information allowing them to destroy American weapons & military personnel?",dataset/twitter_images/afa857e8.jpg,"The “aid” has been utilized in fighting Russia. The more important question is… Why are you still buddies with Putin, while they are giving Iran critical information allowing them to destroy American weapons & military personnel?"
83bd9bef,Twitter,"Actually, most of the funds went to restocking OUR US military   The majority of the billions in aid was actually old expiring ammo/rockets, and decommissioned older equip left over from the Cold War  The $ in the bill was then used to buy OUR military NEW ammo, weapons & equip",dataset/twitter_images/83bd9bef.jpg,"Actually, most of the funds went to restocking OUR US military The majority of the billions in aid was actually old expiring ammo/rockets, and decommissioned older equip left over from the Cold War The $ in the bill was then used to buy OUR military NEW ammo, weapons & equip"
5414f3e4,Twitter,"Another day, another step in Ukraine’s growing international role.  This time: #Bulgaria signs a 10-year security deal with Kyiv.  Military aid, joint weapons production (incl. drones), and a key energy corridor.  #Ukraine isn’t isolating, it’s building ties!",dataset/twitter_images/5414f3e4.jpg,"Another day, another step in Ukraine’s growing international role. This time: #Bulgaria signs a 10-year security deal with Kyiv. Military aid, joint weapons production (incl. drones), and a key energy corridor. #Ukraine isn’t isolating, it’s building ties!"
42d486b4,Twitter,AOC never sent weapons to Israel. She voted against an amendment that would have been attached to an actual military aid bill. She voted against the military aid bill. Why vote for an amendment that would be attached to a bill you’ll vote against anyways?,dataset/twitter_images/42d486b4.jpg,AOC never sent weapons to Israel. She voted against an amendment that would have been attached to an actual military aid bill. She voted against the military aid bill. Why vote for an amendment that would be attached to a bill you’ll vote against anyways?
3d5deae3,Twitter," Rubio: Ukraine weapons ""could"" be diverted to Middle East if Iran conflict escalates  ""Weapons earmarked for Ukraine not currently diverted—but could be"" if regional tensions spike.   Context: • US has committed $100B+ in military aid to Ukraine since 2022 • Iran tensions",dataset/twitter_images/3d5deae3.jpg,"Rubio: Ukraine weapons ""could"" be diverted to Middle East if Iran conflict escalates ""Weapons earmarked for Ukraine not currently diverted—but could be"" if regional tensions spike. Context: • US has committed $100B+ in military aid to Ukraine since 2022 • Iran tensions"
fca18dfa,Twitter,"Ryan Grim got community noted after tweeting that the US is helping Iran by sending weapons to Ukraine to attack Russian oil infrastructure  CN: “Ukraine uses domestically produced long range drones, not US-supplied weapons, for strikes on Russian oil refineries; US military aid",dataset/twitter_images/fca18dfa.jpg,"Ryan Grim got community noted after tweeting that the US is helping Iran by sending weapons to Ukraine to attack Russian oil infrastructure CN: “Ukraine uses domestically produced long range drones, not US-supplied weapons, for strikes on Russian oil refineries; US military aid"
424c766e,Twitter,   | #Pentagon Considers Diverting #Ukraine Military Aid to #MiddleEast  The Pentagon is deciding whether to redirect weapons intended for #Ukraine to the #MiddleEast as the war with #Iran strains U.S. stocks of critical munitions.  The weapons under consideration include,dataset/twitter_images/424c766e.jpg,| #Pentagon Considers Diverting #Ukraine Military Aid to #MiddleEast The Pentagon is deciding whether to redirect weapons intended for #Ukraine to the #MiddleEast as the war with #Iran strains U.S. stocks of critical munitions. The weapons under consideration include
fc2878bc,Twitter,Sure you are. When you're military men show up in a dress or waving the pride flag running for their lives while putting daisies in the barrel of WW II weapons. DON'T CALL America to come to your Aid ! Especially after you mock our President !,dataset/twitter_images/fc2878bc.jpg,Sure you are. When you're military men show up in a dress or waving the pride flag running for their lives while putting daisies in the barrel of WW II weapons. DON'T CALL America to come to your Aid ! Especially after you mock our President !
9eec13c5,Twitter, Pentagon Will Redirect Weapons Meant for Ukraine to the Middle East   https:// reuters.com/world/europe/p entagon-considers-diverting-ukraine-military-aid-middle-east-washington-post-2026-03-26/ …,dataset/twitter_images/9eec13c5.jpg,Pentagon Will Redirect Weapons Meant for Ukraine to the Middle East reuters.com/world/europe/p entagon-considers-diverting-ukraine-military-aid-middle-east-washington-post-2026-03-26/ …
02716030,Twitter,"U.S. Weighs Ukraine Aid Trade‑Off as Iran War Drains Munitions   Pentagon deliberations suggest weapons originally meant for Ukraine could be redirected to support U.S. operations in the Iran conflict as military stocks strain, highlighting growing supply pressures and potential",dataset/twitter_images/02716030.jpg,"U.S. Weighs Ukraine Aid Trade‑Off as Iran War Drains Munitions Pentagon deliberations suggest weapons originally meant for Ukraine could be redirected to support U.S. operations in the Iran conflict as military stocks strain, highlighting growing supply pressures and potential"
aa815769,Twitter," RUBIO: U.S. may redirect weapons meant for Ukraine to the Middle East if needed   Says it’s not happening right now, but Washington will prioritize its own strategic interests   Signals potential shift in military aid if conflict escalation demands  Geopolitics tightening",dataset/twitter_images/aa815769.jpg,"RUBIO: U.S. may redirect weapons meant for Ukraine to the Middle East if needed Says it’s not happening right now, but Washington will prioritize its own strategic interests Signals potential shift in military aid if conflict escalation demands Geopolitics tightening"
e0b99061,Twitter,France has not been reluctant to support Ukraine.  https:// france24.com/en/europe/2025 0919-from-weapons-to-military-training-the-true-scale-of-french-aid-to-ukraine-russia-war …,dataset/twitter_images/e0b99061.jpg,France has not been reluctant to support Ukraine. france24.com/en/europe/2025 0919-from-weapons-to-military-training-the-true-scale-of-french-aid-to-ukraine-russia-war …
091f3211,Twitter, PENTAGON CONSIDERS DIVERTING UKRAINE AID TO MIDDLE EAST  The Pentagon is reportedly considering redirecting $750 million from a $4.5 billion European-funded Ukraine weapons programme to replenish U.S. military stockpiles depleted by the Iran war.  The funds were originally,dataset/twitter_images/091f3211.jpg,PENTAGON CONSIDERS DIVERTING UKRAINE AID TO MIDDLE EAST The Pentagon is reportedly considering redirecting $750 million from a $4.5 billion European-funded Ukraine weapons programme to replenish U.S. military stockpiles depleted by the Iran war. The funds were originally
6d633361,Twitter,| #US–#Ukraine Aid Shift  Washington Post की रिपोर्ट — US ने NATO यूरोपीय देशों के $4.5 billion PURL fund में से $750 million Ukraine के लिए हथियार खरीदने के बजाय अपनी military stocks भरने में लगाने की योजना बनाई।  बताया गया कि Iran युद्ध के कारण US के air-defense weapons भंडार,dataset/twitter_images/6d633361.jpg,| #US–#Ukraine Aid Shift Washington Post की रिपोर्ट — US ने NATO यूरोपीय देशों के $4.5 billion PURL fund में से $750 million Ukraine के लिए हथियार खरीदने के बजाय अपनी military stocks भरने में लगाने की योजना बनाई। बताया गया कि Iran युद्ध के कारण US के air-defense weapons भंडार
7c72ca77,Twitter,"The Pentagon is considering a plan to divert weapons from Ukraine to Middle East, as US war with Iran reaches the one-month mark, according to a Wall Street Journal report on Thursday  http:// v.aa.com.tr/3881066",dataset/twitter_images/7c72ca77.jpg,"The Pentagon is considering a plan to divert weapons from Ukraine to Middle East, as US war with Iran reaches the one-month mark, according to a Wall Street Journal report on Thursday v.aa.com.tr/3881066"
98a53274,Twitter,"The Pentagon is considering diverting military aid for Ukraine to West Asia as the US-Israeli war on Iran depletes weapons stockpiles, according to The Washington Post, citing sources familiar with the matter.  ￭ ""The weapons that could be diverted away from Ukraine include air",dataset/twitter_images/98a53274.jpg,"The Pentagon is considering diverting military aid for Ukraine to West Asia as the US-Israeli war on Iran depletes weapons stockpiles, according to The Washington Post, citing sources familiar with the matter. ￭ ""The weapons that could be diverted away from Ukraine include air"
