id,source,text,image_path,clean_text
9e343073,Twitter,"Pak getting absolutely cooked by Fuel Crisis, queues at petrol stations, 2nd price shock in a month! Middle East tensions exposed how fragile Pak's reserves a& nd import dependence are.  Massive structural rot in #PakistanEconomy Listen to common Pakistani  #PakPetrolCrises",dataset/twitter_images/9e343073.jpg,"Pak getting absolutely cooked by Fuel Crisis, queues at petrol stations, 2nd price shock in a month! Middle East tensions exposed how fragile Pak's reserves a& nd import dependence are. Massive structural rot in #PakistanEconomy Listen to common Pakistani #PakPetrolCrises"
d162b394,Twitter, BREAKING: Middle East crisis live: US and Iranian forces race to recover missing pilot from downed jet; Israel bombards Beirut #War #Ukraine #Iran,dataset/twitter_images/d162b394.jpg,BREAKING: Middle East crisis live: US and Iranian forces race to recover missing pilot from downed jet; Israel bombards Beirut #War #Ukraine #Iran
6f493be2,Twitter,石油と肥料の不足による波及効果は、政府が十分な在庫があると述べているにもかかわらず、インドの農家がパニックに陥る。 https:// orfonline.org/expert-speak/i mpact-of-the-middle-east-crisis-on-the-indian-agricultural-sector …,dataset/twitter_images/6f493be2.jpg,石油と肥料の不足による波及効果は、政府が十分な在庫があると述べているにもかかわらず、インドの農家がパニックに陥る。 orfonline.org/expert-speak/i mpact-of-the-middle-east-crisis-on-the-indian-agricultural-sector …
dbf0b689,Twitter,"JUST IN:  BYD says rising fuel costs driven by the Middle East crisis are accelerating global demand for EVs, as consumers shift away from gasoline-powered cars.",dataset/twitter_images/dbf0b689.jpg,"JUST IN: BYD says rising fuel costs driven by the Middle East crisis are accelerating global demand for EVs, as consumers shift away from gasoline-powered cars."
49c0b137,Twitter,"At a time when the Middle East is trapped in a vicious cycle of ""escalating conflicts-bloc confrontation-crisis spillover,"" the joint voice of China and Pakistan is expected to inject much-needed elements of stability into this region.  http:// xhtxs.cn/bboK",dataset/twitter_images/49c0b137.jpg,"At a time when the Middle East is trapped in a vicious cycle of ""escalating conflicts-bloc confrontation-crisis spillover,"" the joint voice of China and Pakistan is expected to inject much-needed elements of stability into this region. xhtxs.cn/bboK"
ec1e7da0,Twitter, JUST IN: CHINA’S BYD SAYS SURGING FUEL COSTS FROM THE MIDDLE EAST CRISIS ARE DRIVING A BOOST IN ITS EV BUSINESS AS GLOBAL CONSUMERS SHIFT AWAY FROM GASOLINE CARS.,dataset/twitter_images/ec1e7da0.jpg,JUST IN: CHINA’S BYD SAYS SURGING FUEL COSTS FROM THE MIDDLE EAST CRISIS ARE DRIVING A BOOST IN ITS EV BUSINESS AS GLOBAL CONSUMERS SHIFT AWAY FROM GASOLINE CARS.
3fede03e,Twitter,"The Biggest Energy Crisis in History?  Middle East oil exports plunged 63% to ~2.8M b/d, with nearly 40% forced to bypass the closed Strait of Hormuz via the Red Sea. ​ Critical supply drops in Jet fuel (-85%), Diesel/Gasoline (-60-70%), and LPG have triggered mass flight",dataset/twitter_images/3fede03e.jpg,"The Biggest Energy Crisis in History? Middle East oil exports plunged 63% to ~2.8M b/d, with nearly 40% forced to bypass the closed Strait of Hormuz via the Red Sea. ​ Critical supply drops in Jet fuel (-85%), Diesel/Gasoline (-60-70%), and LPG have triggered mass flight"
77183429,Twitter,"This is not a “Middle East crisis”. It is a crisis caused by continued subjugation by white colonial powers and self-interested corporations through hyper-militarisation, with the abused blamed for their own suffering.  RISE eX-detainees  #Iran #eXdetainees #israel #endwar",dataset/twitter_images/77183429.jpg,"This is not a “Middle East crisis”. It is a crisis caused by continued subjugation by white colonial powers and self-interested corporations through hyper-militarisation, with the abused blamed for their own suffering. RISE eX-detainees #Iran #eXdetainees #israel #endwar"
331ed9a5,Twitter,"From MRI to Chip Labs: Silent Helium Crisis Deepens Due To Hormuz Strait Blockade  Middle East tensions have triggered a helium supply crisis, with Qatar halting nearly a third of global output and supply buffers down to ~45 days.  The shortage threatens semiconductors and",dataset/twitter_images/331ed9a5.jpg,"From MRI to Chip Labs: Silent Helium Crisis Deepens Due To Hormuz Strait Blockade Middle East tensions have triggered a helium supply crisis, with Qatar halting nearly a third of global output and supply buffers down to ~45 days. The shortage threatens semiconductors and"
4b10f2fe,Twitter,"In a move aimed at providing relief to the public amid the Middle East crisis, Prime Minister Shehbaz Sharif on Friday reduced the petrol price to Rs378 per litre for a month and slashed the petroleum levy by Rs80 per litre.  #ShehbazSharif #PetrolPrice",dataset/twitter_images/4b10f2fe.jpg,"In a move aimed at providing relief to the public amid the Middle East crisis, Prime Minister Shehbaz Sharif on Friday reduced the petrol price to Rs378 per litre for a month and slashed the petroleum levy by Rs80 per litre. #ShehbazSharif #PetrolPrice"
61f66203,Twitter,"The escalating crisis in the Middle East has created severe uncertainty in air travel, with a direct impact on Chattogram’s.....  #middleeast #crisis #flights #cancellation #DailySun   https:// daily-sun.com/bangladesh/866 754 …",dataset/twitter_images/61f66203.jpg,"The escalating crisis in the Middle East has created severe uncertainty in air travel, with a direct impact on Chattogram’s..... #middleeast #crisis #flights #cancellation #DailySun daily-sun.com/bangladesh/866 754 …"
dbb44b48,Twitter,"We are now facing the biggest global energy crisis in history:  Total oil product exports from the Middle East plunged -63% in March, or -4.8 million barrels per day, to ~2.8 million barrels per day.  Of the remaining ~2.8 million barrels per day still being exported, ~1.1",dataset/twitter_images/dbb44b48.jpg,"We are now facing the biggest global energy crisis in history: Total oil product exports from the Middle East plunged -63% in March, or -4.8 million barrels per day, to ~2.8 million barrels per day. Of the remaining ~2.8 million barrels per day still being exported, ~1.1"
19aa6b97,Twitter,"Middle East Energy Crisis: Reshaping Global Supply Chains BYMUFLIH HIDAYATON APRIL 4, 2026  https:// discoveryalert.com.au/energy-crisis- middle-east-2026-market-impacts/ …",dataset/twitter_images/19aa6b97.jpg,"Middle East Energy Crisis: Reshaping Global Supply Chains BYMUFLIH HIDAYATON APRIL 4, 2026 discoveryalert.com.au/energy-crisis- middle-east-2026-market-impacts/ …"
b30e4ca4,Twitter,“Everyone’s asking: where is this Middle East crisis actually heading? Let’s break it down honestly. If the conflict drags on: •  America gets hurt the most — high oil prices eventually tank the economy and Trump takes the political hit. •  Israel can weaken Iran but pays a,dataset/twitter_images/b30e4ca4.jpg,“Everyone’s asking: where is this Middle East crisis actually heading? Let’s break it down honestly. If the conflict drags on: • America gets hurt the most — high oil prices eventually tank the economy and Trump takes the political hit. • Israel can weaken Iran but pays a
8a4751d9,Twitter,"no 9/11, no middle east wars, no 2008 financial crisis, early and bold climate action.",dataset/twitter_images/8a4751d9.jpg,"no 9/11, no middle east wars, no 2008 financial crisis, early and bold climate action."
9ec75946,Twitter,"The Kremlin confirmed on Friday that Vladimir Putin is devoting considerable time to the escalating Middle East crisis, a disclosure that, for anyone following the arc of this war, carries more weight than the bland official language suggests. Moscow's anxiety is not diplomatic;",dataset/twitter_images/9ec75946.jpg,"The Kremlin confirmed on Friday that Vladimir Putin is devoting considerable time to the escalating Middle East crisis, a disclosure that, for anyone following the arc of this war, carries more weight than the bland official language suggests. Moscow's anxiety is not diplomatic;"
a3df3316,Twitter,"In accordance with President Ferdinand R. Marcos Jr.’s directive to provide quick assistance to Filipinos affected by the Middle East crisis and to ensure government services are always available to them, the seventh chartered flight arrived at Villamor Air Base in Pasay City on",dataset/twitter_images/a3df3316.jpg,"In accordance with President Ferdinand R. Marcos Jr.’s directive to provide quick assistance to Filipinos affected by the Middle East crisis and to ensure government services are always available to them, the seventh chartered flight arrived at Villamor Air Base in Pasay City on"
6b23c059,Twitter,‘𝐏𝐫𝐨𝐥𝐨𝐧𝐠𝐞𝐝 𝐌𝐢𝐝𝐝𝐥𝐞 𝐄𝐚𝐬𝐭 𝐜𝐫𝐢𝐬𝐢𝐬 𝐦𝐚𝐲 𝐡𝐢𝐤𝐞 𝐟𝐨𝐨𝐝 𝐩𝐫𝐢𝐜𝐞𝐬’    https:// punchng.com/prolonged-midd le-east-crisis-may-hike-food-prices/ …,dataset/twitter_images/6b23c059.jpg,‘𝐏𝐫𝐨𝐥𝐨𝐧𝐠𝐞𝐝 𝐌𝐢𝐝𝐝𝐥𝐞 𝐄𝐚𝐬𝐭 𝐜𝐫𝐢𝐬𝐢𝐬 𝐦𝐚𝐲 𝐡𝐢𝐤𝐞 𝐟𝐨𝐨𝐝 𝐩𝐫𝐢𝐜𝐞𝐬’ punchng.com/prolonged-midd le-east-crisis-may-hike-food-prices/ …
2c861975,Twitter,"China Shows  in The Face of The Middle East Crisis  Esse é o título da matéria da Blommberg  Resiliência surpreendente  Surpreendente para quem? Estamos alertando e analisando há semanas que a China  será a grande vencedora e a sua globalização soberanista, inclusiva e",dataset/twitter_images/2c861975.jpg,"China Shows in The Face of The Middle East Crisis Esse é o título da matéria da Blommberg Resiliência surpreendente Surpreendente para quem? Estamos alertando e analisando há semanas que a China será a grande vencedora e a sua globalização soberanista, inclusiva e"
41343790,Twitter,"KUALA LUMPUR, April 4 — Former Investment, Trade and Industry Minister Datuk Seri Tengku Zafrul Abdul Aziz has urged the government to maintain a structured stimulus plan.   https:// pocketnews.com.my/2026/04/04/zaf rul-urges-government-to-keep-stimulus-ready-amid-middle-east-crisis/ …",dataset/twitter_images/41343790.jpg,"KUALA LUMPUR, April 4 — Former Investment, Trade and Industry Minister Datuk Seri Tengku Zafrul Abdul Aziz has urged the government to maintain a structured stimulus plan. pocketnews.com.my/2026/04/04/zaf rul-urges-government-to-keep-stimulus-ready-amid-middle-east-crisis/ …"
bbf171fd,Twitter,"The first two started wars first, THEN crashed the economy. The third never crashed the economy and is ending a war in the middle east.   Meanwhile, these two POS scumbags put 13 million more Americans on food stamps and caused the worst inflation crisis in 40 years. ",dataset/twitter_images/bbf171fd.jpg,"The first two started wars first, THEN crashed the economy. The third never crashed the economy and is ending a war in the middle east. Meanwhile, these two POS scumbags put 13 million more Americans on food stamps and caused the worst inflation crisis in 40 years."
c7b2e577,Twitter,Time is a flat circle man  Ye is putting out music and hitting on Meghan fox  We’re at war in the Middle East  Brain slop tv drama spilling out into irl  Financial crisis inbound  It’s 2003 man!!,dataset/twitter_images/c7b2e577.jpg,Time is a flat circle man Ye is putting out music and hitting on Meghan fox We’re at war in the Middle East Brain slop tv drama spilling out into irl Financial crisis inbound It’s 2003 man!!
a743ba3c,Twitter,"India’s smartphone exports, a key asset for the country as a manufacturing nation, are facing geopolitical risks as the UAE, a major air logistics hub, is caught up in the Middle East crisis.  https:// s.nikkei.com/4m6PSEu",dataset/twitter_images/a743ba3c.jpg,"India’s smartphone exports, a key asset for the country as a manufacturing nation, are facing geopolitical risks as the UAE, a major air logistics hub, is caught up in the Middle East crisis. s.nikkei.com/4m6PSEu"
dd00aca4,Twitter,BREAKING:  Middle East oil exports just collapsed.  Supply is now running 12 million barrels/day below 2025 levels.  Everyone thinks inflation is dead.  It isn’t.  This is how you get:  $100+ oil Higher gas prices No Fed cuts Another stock selloff  Energy Crisis Watchlist:  $XOM,dataset/twitter_images/dd00aca4.jpg,BREAKING: Middle East oil exports just collapsed. Supply is now running 12 million barrels/day below 2025 levels. Everyone thinks inflation is dead. It isn’t. This is how you get: $100+ oil Higher gas prices No Fed cuts Another stock selloff Energy Crisis Watchlist: $XOM
be44326d,Twitter,Let me explain how bad the energy crisis actually is right now.  Middle East oil exports down 63% in March.  Not 10%. Not 20%.  63%.  4.8 million barrels a day — gone.  Jet fuel exports down 85%.  Flights being cancelled across Asia-Pacific right now.  Not because of weather.,dataset/twitter_images/be44326d.jpg,Let me explain how bad the energy crisis actually is right now. Middle East oil exports down 63% in March. Not 10%. Not 20%. 63%. 4.8 million barrels a day — gone. Jet fuel exports down 85%. Flights being cancelled across Asia-Pacific right now. Not because of weather.
fa4f2d3e,Twitter,"With the crisis in the Middle East having significant supply chain disruptions, it has many asking what Australia can do to be more self-sufficient. Our CEO Annabel Johnson asked CEO of Fertilizer Australia Stephen Annells what could help drive domestic fertiliser production.",dataset/twitter_images/fa4f2d3e.jpg,"With the crisis in the Middle East having significant supply chain disruptions, it has many asking what Australia can do to be more self-sufficient. Our CEO Annabel Johnson asked CEO of Fertilizer Australia Stephen Annells what could help drive domestic fertiliser production."
a8b1564c,Twitter,Did you side with our UK and French allies in the Suez crisis in 1956 or UK in the Falklands?  No.  And yes I served pre/post 9/11 with US brothers in the Middle East   ,dataset/twitter_images/a8b1564c.jpg,Did you side with our UK and French allies in the Suez crisis in 1956 or UK in the Falklands? No. And yes I served pre/post 9/11 with US brothers in the Middle East
e13f66b1,Twitter,"Amid Middle East Crisis, Industrial Diesel Prices Hiked By Rs 28 A Litre  https:// ndtv.com/india-news/oil -prices-amid-middle-east-crisis-industrial-diesel-prices-hiked-by-rs-28-a-litre-11304327 …",dataset/twitter_images/e13f66b1.jpg,"Amid Middle East Crisis, Industrial Diesel Prices Hiked By Rs 28 A Litre ndtv.com/india-news/oil -prices-amid-middle-east-crisis-industrial-diesel-prices-hiked-by-rs-28-a-litre-11304327 …"
28d49dcd,Twitter," Russia to boost oil & LNG for India amid Middle East crisis   Deputy PM Manturov pledges ramped up oil, LNG, fertilizer supplies & deeper nuclear and tech ties.   #IndiaRussiaPartnership #EnergySecurity #MiddleEastCrisis",dataset/twitter_images/28d49dcd.jpg,"Russia to boost oil & LNG for India amid Middle East crisis Deputy PM Manturov pledges ramped up oil, LNG, fertilizer supplies & deeper nuclear and tech ties. #IndiaRussiaPartnership #EnergySecurity #MiddleEastCrisis"
764a56e0,Twitter,"Beyond Fuel: What Looms as Africa's Greatest Risk Amid Middle East Crisis?  The Middle East crisis has disrupted global supply chains, driving up fuel prices and threatening African countries' energy security—with wider economic damage likely if supply routes remain closed.",dataset/twitter_images/764a56e0.jpg,"Beyond Fuel: What Looms as Africa's Greatest Risk Amid Middle East Crisis? The Middle East crisis has disrupted global supply chains, driving up fuel prices and threatening African countries' energy security—with wider economic damage likely if supply routes remain closed."
04f36f9e,Twitter," Russia : On April 4, 2026, a Russian strike on a market in a frontline Ukrainian city kills five people and injures others! This highlights the ongoing escalation of the war with Ukraine, disrupting civilian areas and complicating peace efforts, while Putin's firm policy",dataset/twitter_images/04f36f9e.jpg,"Russia : On April 4, 2026, a Russian strike on a market in a frontline Ukrainian city kills five people and injures others! This highlights the ongoing escalation of the war with Ukraine, disrupting civilian areas and complicating peace efforts, while Putin's firm policy"
a07b5c67,Twitter,"RUS/UKR WAR ""The Frontline is like Terminator"" - Fighting Robots give Ukraine Hope in War with Russia  https:// tinyurl.com/4ax7wru3",dataset/twitter_images/a07b5c67.jpg,"RUS/UKR WAR ""The Frontline is like Terminator"" - Fighting Robots give Ukraine Hope in War with Russia tinyurl.com/4ax7wru3"
9497163a,Twitter," The war in Ukraine is increasingly being shaped by robotic warfare, with unmanned ground vehicles expanding rapidly since 2024.  These machines are transforming the frontline into a high-tech battle, giving Ukrainian forces new hope against Russia as the conflict evolves into",dataset/twitter_images/9497163a.jpg,"The war in Ukraine is increasingly being shaped by robotic warfare, with unmanned ground vehicles expanding rapidly since 2024. These machines are transforming the frontline into a high-tech battle, giving Ukrainian forces new hope against Russia as the conflict evolves into"
984c8168,Twitter,This is real battlefield footage of Russian soldiers. What you see here is something most media won’t show. War is never what people think it is #Russia #WarReality #UnseenFootage #Frontline #Military #UkraineWar #GeoPolitics #Truth #Viral #Breaking,dataset/twitter_images/984c8168.jpg,This is real battlefield footage of Russian soldiers. What you see here is something most media won’t show. War is never what people think it is #Russia #WarReality #UnseenFootage #Frontline #Military #UkraineWar #GeoPolitics #Truth #Viral #Breaking
993cfc95,Twitter,"An interesting Drones Doctrinal development in Russo-Ukraine war.   Ukraine first established a Drones Line to put in a curtain of drones of adequate depth of >15 km along the complete frontline to block Russian advances. It succeeded in most defensive missions   Now, Russia is",dataset/twitter_images/993cfc95.jpg,"An interesting Drones Doctrinal development in Russo-Ukraine war. Ukraine first established a Drones Line to put in a curtain of drones of adequate depth of >15 km along the complete frontline to block Russian advances. It succeeded in most defensive missions Now, Russia is"
8ea63793,Twitter,"Remember the Russian propaganda accounts a year ago saying Ukraine’s frontline will collapse, iTs a WaR oF aTtRiTiOn, RuSsIa WiLl sTaRt MaKiNg MaSsiVe gAiNs  None of it happened, Russia hasn’t taken Kramatorsk, Slovyansk, or Kostyantynivka after years and is advancing even slower",dataset/twitter_images/8ea63793.jpg,"Remember the Russian propaganda accounts a year ago saying Ukraine’s frontline will collapse, iTs a WaR oF aTtRiTiOn, RuSsIa WiLl sTaRt MaKiNg MaSsiVe gAiNs None of it happened, Russia hasn’t taken Kramatorsk, Slovyansk, or Kostyantynivka after years and is advancing even slower"
a3a077a4,Twitter,"“Real Talk” with Segi!  Drones are rewriting the rules of modern war and Ukraine is leading that transformation. In this episode of Real Talk, Segi and Alex explore how frontline units like Wild Hornets design, build, and deploy drones that save lives and stop attacks before they",dataset/twitter_images/a3a077a4.jpg,"“Real Talk” with Segi! Drones are rewriting the rules of modern war and Ukraine is leading that transformation. In this episode of Real Talk, Segi and Alex explore how frontline units like Wild Hornets design, build, and deploy drones that save lives and stop attacks before they"
e7b8c8ff,Twitter,"EUROGHOST INVESTIGATION:  Zelenskiy's War Claims – Fact or Fiction?  Ukrainian president Volodymyr Zelenskiy has today claimed that the frontline situation is the best it has been for Ukraine in the last 10 months. At a press conference, he stated: “Overall, the front line",dataset/twitter_images/e7b8c8ff.jpg,"EUROGHOST INVESTIGATION: Zelenskiy's War Claims – Fact or Fiction? Ukrainian president Volodymyr Zelenskiy has today claimed that the frontline situation is the best it has been for Ukraine in the last 10 months. At a press conference, he stated: “Overall, the front line"
9f6dca2e,Twitter,"Kherson  Viktoriia and her children were among the 58,560 families in frontline regions who received winter cash assistance from UNICEF. She used it to buy warm children's clothes.  ""We spend almost all our time in the shelter,"" she says. ""I just want the war to end soon.""",dataset/twitter_images/9f6dca2e.jpg,"Kherson Viktoriia and her children were among the 58,560 families in frontline regions who received winter cash assistance from UNICEF. She used it to buy warm children's clothes. ""We spend almost all our time in the shelter,"" she says. ""I just want the war to end soon."""
96ce1b8f,Twitter," Ukrianian President Volodymyr Zelenskiy said the frontline situation for Ukraine is the best it has been in ten months, adding that a planned Russian offensive in March was thwarted.   He said he invited U.S. negotiators to Kyiv and heard positive signals in response.",dataset/twitter_images/96ce1b8f.jpg,"Ukrianian President Volodymyr Zelenskiy said the frontline situation for Ukraine is the best it has been in ten months, adding that a planned Russian offensive in March was thwarted. He said he invited U.S. negotiators to Kyiv and heard positive signals in response."
4881889c,Twitter,"Frontline Pawns Stranded In Russia:  Tales emerging from Kenyans stranded in the war between Russia and Ukraine continue to reveal how deception, human-trafficking and lack of State accountability played a part in the deployment of hundreds of Kenyans into the frontline.",dataset/twitter_images/4881889c.jpg,"Frontline Pawns Stranded In Russia: Tales emerging from Kenyans stranded in the war between Russia and Ukraine continue to reveal how deception, human-trafficking and lack of State accountability played a part in the deployment of hundreds of Kenyans into the frontline."
64898a7e,Twitter,"According to reports,  @BugandaKingdom_  official  Omutaka Kasuja Lubinga is very depressed after his eldest son identified as Bashir Nandere was shot dead on the frontline in war torn Ukraine in Europe.  Information we have obtained reveals that the late Bashir left uganda in",dataset/twitter_images/64898a7e.jpg,"According to reports, official Omutaka Kasuja Lubinga is very depressed after his eldest son identified as Bashir Nandere was shot dead on the frontline in war torn Ukraine in Europe. Information we have obtained reveals that the late Bashir left uganda in"
8861e324,Twitter,"Russian sympathizers love to scream “war crime” the moment Ukraine touches a soldier who crossed the border to invade their country.   But when a Russian drone hunting civilians in Nikopol or any other frontline city, they have nothing to say about.   This is a DAILY human",dataset/twitter_images/8861e324.jpg,"Russian sympathizers love to scream “war crime” the moment Ukraine touches a soldier who crossed the border to invade their country. But when a Russian drone hunting civilians in Nikopol or any other frontline city, they have nothing to say about. This is a DAILY human"
e69a354e,Twitter,"NEWS UPDATE: 16 Kenyans missing or dead, 38 hospitalized, 47 repatriated, and 165 still on the frontline in the Russia–Ukraine war — Foreign Affairs CS  @MusaliaMudavadi    #HapaNdipo",dataset/twitter_images/e69a354e.jpg,"NEWS UPDATE: 16 Kenyans missing or dead, 38 hospitalized, 47 repatriated, and 165 still on the frontline in the Russia–Ukraine war — Foreign Affairs CS #HapaNdipo"
3983c6a9,Twitter,"#UPDATE. According to reports, Buganda kingdom official  Omutaka Kasuja Lubinga is very depressed after his eldest son identified as Bashir Nandere was shot dead on the frontline in war torn Ukraine in Europe.  Information we have obtained reveals that the late Bashir left uganda",dataset/twitter_images/3983c6a9.jpg,"#UPDATE. According to reports, Buganda kingdom official Omutaka Kasuja Lubinga is very depressed after his eldest son identified as Bashir Nandere was shot dead on the frontline in war torn Ukraine in Europe. Information we have obtained reveals that the late Bashir left uganda"
331f65c0,Twitter,Armenia Becomes Frontline In Russia-West Rivalry As It Heads To Polls #Armenia #Becomes #Frontline #Russia-West #Rivalry #Heads #Polls #USA #Russia #Biden #Ukraine #War #Palestine #Gaza #Israel #  http:// dlvr.it/TRqhry,dataset/twitter_images/331f65c0.jpg,Armenia Becomes Frontline In Russia-West Rivalry As It Heads To Polls #Armenia #Becomes #Frontline #Russia-West #Rivalry #Heads #Polls #USA #Russia #Biden #Ukraine #War #Palestine #Gaza #Israel # dlvr.it/TRqhry
f1c3bddb,Twitter,"According to reports, Buganda kingdom official  Omutaka Kasuja Lubinga is very depressed after his eldest son identified as Bashir Nandere was shot dead on the frontline in war torn Ukraine in Europe.  Information we have obtained reveals that the late Bashir left uganda in early",dataset/twitter_images/f1c3bddb.jpg,"According to reports, Buganda kingdom official Omutaka Kasuja Lubinga is very depressed after his eldest son identified as Bashir Nandere was shot dead on the frontline in war torn Ukraine in Europe. Information we have obtained reveals that the late Bashir left uganda in early"
