id,source,text,image_path,clean_text
fca4cf26,Twitter,Iranian’s latest drone: A tactical salute to the legend of Tupac  A missile labeled with “Killuminati” — a nod to The Don Killuminati: The 7 Day Theory by Tupac Shakur — mixing pop culture with real-world conflict.  Surreal… and unsettling.  #Tupac #Killuminati #Geopolitics #War,dataset/twitter_images/fca4cf26.jpg,Iranian’s latest drone: A tactical salute to the legend of Tupac A missile labeled with “Killuminati” — a nod to The Don Killuminati: The 7 Day Theory by Tupac Shakur — mixing pop culture with real-world conflict. Surreal… and unsettling. #Tupac #Killuminati #Geopolitics #War
1112bc9f,Twitter,The US–Iran conflict is no longer speculation.  It is active warfare — with global consequences.   Nuclear tensions  Strait of Hormuz risk  Global oil shock  NATO uncertainty This war could reshape the future world order. Link  in bio for article  #USIranWar #Geopolitics,dataset/twitter_images/1112bc9f.jpg,The US–Iran conflict is no longer speculation. It is active warfare — with global consequences. Nuclear tensions Strait of Hormuz risk Global oil shock NATO uncertainty This war could reshape the future world order. Link in bio for article #USIranWar #Geopolitics
27592fd3,Twitter,"For the first time in over two decades, U.S. military jets have been downed by enemy fire in the Iran conflict.  We're moving from a precision-strike phase into a much more dangerous, contested air war.   #Geopolitics #MilitaryNews #IranWar",dataset/twitter_images/27592fd3.jpg,"For the first time in over two decades, U.S. military jets have been downed by enemy fire in the Iran conflict. We're moving from a precision-strike phase into a much more dangerous, contested air war. #Geopolitics #MilitaryNews #IranWar"
01755157,Twitter,"Even Europe's far-right is breaking with Trump over the Iran war. This conflict undermines his isolationist vision and raises global energy prices, proving one man's choices can disrupt the entire world economy. #Geopolitics #WorldAffairs #Trump",dataset/twitter_images/01755157.jpg,"Even Europe's far-right is breaking with Trump over the Iran war. This conflict undermines his isolationist vision and raises global energy prices, proving one man's choices can disrupt the entire world economy. #Geopolitics #WorldAffairs #Trump"
5c3e6271,Twitter, THE PETRODOLLAR WAR!  Why the Iran Conflict is REALLY About Saving the U.S. Dollar Dominance  #Petrodollar #USADollar #Geopolitics #EconomyNews #IranConflict #OilMarket #GlobalFinance #MacroEconomics #WorldNews #StraitOfHormuz #FinancialHistory ,dataset/twitter_images/5c3e6271.jpg,THE PETRODOLLAR WAR! Why the Iran Conflict is REALLY About Saving the U.S. Dollar Dominance #Petrodollar #USADollar #Geopolitics #EconomyNews #IranConflict #OilMarket #GlobalFinance #MacroEconomics #WorldNews #StraitOfHormuz #FinancialHistory
75d18f28,Twitter,"As Team Trump wage unceasing war on Iran, evangelical nationalists are destroying any moral world... | The Guardian  Shared Via InSnaps App:  https:// credibletechnologies.in/a/L_9YlRB8t39E brtMY6pU7Bg8Jvd-as8ee93LszHR9WblvYrCYeEWGH_J3UKEdWJAz0MOIrApncYlcKijpOaY0vUwsmxqJvuelDDMp2oFTMc3978Q8wC1r2zrhv4nDBgyEx3jrToSu0A-TkVR …  #TheGuardian #Irans #Conflict #Team #Trump #Iran #Geopolitics",dataset/twitter_images/75d18f28.jpg,"As Team Trump wage unceasing war on Iran, evangelical nationalists are destroying any moral world... | The Guardian Shared Via InSnaps App: credibletechnologies.in/a/L_9YlRB8t39E brtMY6pU7Bg8Jvd-as8ee93LszHR9WblvYrCYeEWGH_J3UKEdWJAz0MOIrApncYlcKijpOaY0vUwsmxqJvuelDDMp2oFTMc3978Q8wC1r2zrhv4nDBgyEx3jrToSu0A-TkVR … #TheGuardian #Irans #Conflict #Team #Trump #Iran #Geopolitics"
2b093681,Twitter,What Is Iran’s Mosaic Leadership? #Iran #Geopolitics #MiddleEast #GlobalSecurity #WarStrategy #InternationalRelations #WorldPolitics #Conflict #Power #Strategy #BreakingNews #GlobalCrisis #War #Military #Defense #Security #iran   https:// theinternationalwire.com/iran-mosaic-le adership-system-survive-war/ …,dataset/twitter_images/2b093681.jpg,What Is Iran’s Mosaic Leadership? #Iran #Geopolitics #MiddleEast #GlobalSecurity #WarStrategy #InternationalRelations #WorldPolitics #Conflict #Power #Strategy #BreakingNews #GlobalCrisis #War #Military #Defense #Security #iran theinternationalwire.com/iran-mosaic-le adership-system-survive-war/ …
e9a18180,Twitter,کیا ٹرمپ صرف عمران سے خائف یا پاکستانی عوام سے؟ عوام اور قوم میں کیا فرق ہے؟ #BreakingNews #GlobalUpdate #WorldAffairs #StayInformed #NewsUpdate #iran #war #SocialAwareness #InformationalContent #TrendingNow #CurrentEvents #middleeast #geopolitics #PublicDiscussion #conflict,dataset/twitter_images/e9a18180.jpg,کیا ٹرمپ صرف عمران سے خائف یا پاکستانی عوام سے؟ عوام اور قوم میں کیا فرق ہے؟ #BreakingNews #GlobalUpdate #WorldAffairs #StayInformed #NewsUpdate #iran #war #SocialAwareness #InformationalContent #TrendingNow #CurrentEvents #middleeast #geopolitics #PublicDiscussion #conflict
526315b9,Twitter,A historic $1.5 trillion defence budget proposal signals the scale of the Iran conflict and rising global tensions.  Read More:  https:// indoustribune.com/special-report /white-house-1-5-trillion-defense-budget-iran-war/ …  #USDefense #Trump #IranConflict #Pentagon #WorldNews #teenagegirls #Geopolitics #IsraelIran #MilitarySpending #GlobalTensions,dataset/twitter_images/526315b9.jpg,A historic $1.5 trillion defence budget proposal signals the scale of the Iran conflict and rising global tensions. Read More: indoustribune.com/special-report /white-house-1-5-trillion-defense-budget-iran-war/ … #USDefense #Trump #IranConflict #Pentagon #WorldNews #teenagegirls #Geopolitics #IsraelIran #MilitarySpending #GlobalTensions
6e46f2e5,Twitter,Iran Warning To Trump Over War | ಅಮೆರಿಕ ಷರತ್ತು ನಾವು ಒಪ್ಪಲ್ಲ ಇರಾನ್ ಖಡಕ್ ಎಚ್ಚರಿಕೆ  #iran #trump #iranwarning #usiran #geopolitics #worldnews #breakingnews #middleeast #iranvsusa #politics #internationalnews #warnews #globaltension #diplomacy #newsupdate #leadership #conflict,dataset/twitter_images/6e46f2e5.jpg,Iran Warning To Trump Over War | ಅಮೆರಿಕ ಷರತ್ತು ನಾವು ಒಪ್ಪಲ್ಲ ಇರಾನ್ ಖಡಕ್ ಎಚ್ಚರಿಕೆ #iran #trump #iranwarning #usiran #geopolitics #worldnews #breakingnews #middleeast #iranvsusa #politics #internationalnews #warnews #globaltension #diplomacy #newsupdate #leadership #conflict
0aec3109,Twitter,"Iran: The war that was supposed to break the regime may make it stronger  Five weeks after the start of intensive US-Israeli strikes on Iranian nuclear and military facilities, the conflict has turned into a classic example of asymmetric warfare. President Donald Trump",dataset/twitter_images/0aec3109.jpg,"Iran: The war that was supposed to break the regime may make it stronger Five weeks after the start of intensive US-Israeli strikes on Iranian nuclear and military facilities, the conflict has turned into a classic example of asymmetric warfare. President Donald Trump"
54d17912,Twitter, JUST IN:  Iran warns strikes on its Bushehr nuclear plant could trigger catastrophic fallout across Gulf capitals  Nuclear risk now in play  Regional escalation accelerating ...this is no longer just a conflict It’s a global risk  #BreakingNews #Geopolitics #Oil #War,dataset/twitter_images/54d17912.jpg,JUST IN: Iran warns strikes on its Bushehr nuclear plant could trigger catastrophic fallout across Gulf capitals Nuclear risk now in play Regional escalation accelerating ...this is no longer just a conflict It’s a global risk #BreakingNews #Geopolitics #Oil #War
595c5d40,Twitter,"Iran shot down a U.S. fighter jet, with one crew member rescued and another still missing, marking a major escalation.  Click to know more -  https:// urbananews.ca/iran-war-escal ation-us-aircraft-shot-down-as-conflict-reaches-new-turning-point/ …  #Iran #Geopolitics #OilCrisis",dataset/twitter_images/595c5d40.jpg,"Iran shot down a U.S. fighter jet, with one crew member rescued and another still missing, marking a major escalation. Click to know more - urbananews.ca/iran-war-escal ation-us-aircraft-shot-down-as-conflict-reaches-new-turning-point/ … #Iran #Geopolitics #OilCrisis"
124d7ec5,Twitter,"‘Your sons are more in danger with Trump’: Iran’s chilling message to a US pilot’s mother after a jet was downed. As tensions rise, the war of words turns sharper.   Read:  http:// indiatoday.in/world/story/ir…  #Iran #USA #Trump #Geopolitics #Conflict #IndiaTodayGlobal",dataset/twitter_images/124d7ec5.jpg,"‘Your sons are more in danger with Trump’: Iran’s chilling message to a US pilot’s mother after a jet was downed. As tensions rise, the war of words turns sharper. Read: indiatoday.in/world/story/ir… #Iran #USA #Trump #Geopolitics #Conflict #IndiaTodayGlobal"
4c651402,Twitter,"‘Your sons are more in danger with Trump’: Iran’s chilling message to a US pilot’s mother after a jet was downed. As tensions rise, the war of words turns sharper.   Read:  https:// indiatoday.in/world/story/ir an-responds-us-f15-pilot-mother-danger-trump-custody-middle-east-war-trump-2891531-2026-04-04 …  #Iran #USA #Trump #Geopolitics #Conflict #IndiaTodayGlobal",dataset/twitter_images/4c651402.jpg,"‘Your sons are more in danger with Trump’: Iran’s chilling message to a US pilot’s mother after a jet was downed. As tensions rise, the war of words turns sharper. Read: indiatoday.in/world/story/ir an-responds-us-f15-pilot-mother-danger-trump-custody-middle-east-war-trump-2891531-2026-04-04 … #Iran #USA #Trump #Geopolitics #Conflict #IndiaTodayGlobal"
6f5eac9d,Twitter,"U.S. added 178,000 jobs in March, a resilient labor market just as Iran war escalated - NBC News  Shared Via InSnaps App:  https:// credibletechnologies.in/a/L_9InhB49G9E brtMC5NaKoKV7NPVip3aNYmqtCej008Bg1pWyt-nVefePPQF0sT2wWFsZkVInjDnH5Zm4PAPzcLBpgGn13Zgptguhg …  #NbcNews #Irans #Conflict #March #Iran #Nbc #Geopolitics",dataset/twitter_images/6f5eac9d.jpg,"U.S. added 178,000 jobs in March, a resilient labor market just as Iran war escalated - NBC News Shared Via InSnaps App: credibletechnologies.in/a/L_9InhB49G9E brtMC5NaKoKV7NPVip3aNYmqtCej008Bg1pWyt-nVefePPQF0sT2wWFsZkVInjDnH5Zm4PAPzcLBpgGn13Zgptguhg … #NbcNews #Irans #Conflict #March #Iran #Nbc #Geopolitics"
1d103737,Twitter,US military archbishop says Iran conflict does not meet ‘just war’ standard -  http:// theguardian.com  Shared Via InSnaps App:  https:// credibletechnologies.in/a/L_9Ylwh49G9A bqtIhxknCafIPeheu8h7ZIoPLsItDQw9MEW6GaY7S0AAwjp1Km4lOev3rTwIN-epDIbkWoZAd8Q8IkV_3gugMjYSLnM …  #Theguardiancom #Irans #Conflict #Iran #Timothy #Broglio #Geopolitics,dataset/twitter_images/1d103737.jpg,US military archbishop says Iran conflict does not meet ‘just war’ standard - theguardian.com Shared Via InSnaps App: credibletechnologies.in/a/L_9Ylwh49G9A bqtIhxknCafIPeheu8h7ZIoPLsItDQw9MEW6GaY7S0AAwjp1Km4lOev3rTwIN-epDIbkWoZAd8Q8IkV_3gugMjYSLnM … #Theguardiancom #Irans #Conflict #Iran #Timothy #Broglio #Geopolitics
1a2f1080,Twitter,"#MultipolarWorld #Multipolarity Ascens de la Xina, BRICS, Sud Global, proteccionisme, decadència de Nacions Unides, migracions descontrolades: camí de la #WorldWarIII  https:// postfactum.co.uk/multipolar-wor ld-geopolitics-polarity-major-power-us-china-eu-security-ukraineglobal-order-multipolarity-bipolarity-cold-war-russia-india-brazil-turkey-indonesia-brics-conflict-hegemony-leader-race-struggle-rival-rivalry-1991-2025 …",dataset/twitter_images/1a2f1080.jpg,"#MultipolarWorld #Multipolarity Ascens de la Xina, BRICS, Sud Global, proteccionisme, decadència de Nacions Unides, migracions descontrolades: camí de la #WorldWarIII postfactum.co.uk/multipolar-wor ld-geopolitics-polarity-major-power-us-china-eu-security-ukraineglobal-order-multipolarity-bipolarity-cold-war-russia-india-brazil-turkey-indonesia-brics-conflict-hegemony-leader-race-struggle-rival-rivalry-1991-2025 …"
4e558f10,Twitter,"The Law of Escalation from Game Theory explains escalating conflicts. Key questions for Iran-US war: ground invasion, nuclear weapon use, and damage to Al-Aqsa Mosque. The latter could trigger a global conflict. #GameTheory #Geopolitics #Conflict",dataset/twitter_images/4e558f10.jpg,"The Law of Escalation from Game Theory explains escalating conflicts. Key questions for Iran-US war: ground invasion, nuclear weapon use, and damage to Al-Aqsa Mosque. The latter could trigger a global conflict. #GameTheory #Geopolitics #Conflict"
37bc99c6,Twitter,"War isn't a game with set rules - it is total chaos. Why expect Trump to predict the unpredictable in the Iran conflict? A bold take on modern warfare, geopolitics, and the criticism surrounding his exit strategy.  Watch the full breakdown of Dr Roger Gewolb on @ndtv below.",dataset/twitter_images/37bc99c6.jpg,"War isn't a game with set rules - it is total chaos. Why expect Trump to predict the unpredictable in the Iran conflict? A bold take on modern warfare, geopolitics, and the criticism surrounding his exit strategy. Watch the full breakdown of Dr Roger Gewolb on below."
33ebdac9,Twitter,"War isn't a game with set rules - it is total chaos. Why expect Trump to predict the unpredictable in the Iran conflict? A bold take on modern warfare, geopolitics, and the criticism surrounding his exit strategy.  Watch the full breakdown of Dr Roger Gewolb on  @ndtv  below.",dataset/twitter_images/33ebdac9.jpg,"War isn't a game with set rules - it is total chaos. Why expect Trump to predict the unpredictable in the Iran conflict? A bold take on modern warfare, geopolitics, and the criticism surrounding his exit strategy. Watch the full breakdown of Dr Roger Gewolb on below."
6decc113,Twitter,"Iran claims it shot down US warplanes, with one pilot missing as rescue missions unfold. Tensions with United States escalate amid ongoing conflict.  #Iran #US #MiddleEast #War #Geopolitics #Breaking",dataset/twitter_images/6decc113.jpg,"Iran claims it shot down US warplanes, with one pilot missing as rescue missions unfold. Tensions with United States escalate amid ongoing conflict. #Iran #US #MiddleEast #War #Geopolitics #Breaking"
451e5bdd,Twitter,"Live updates: Iran war news, US and Iran race to find crew member from downed F-15 jet - CNN  Shared Via InSnaps App:  https:// credibletechnologies.in/a/L_9YnRB4tH9E brtMqyFRKoJ1T_sHeSe0uxH7qPRBoNePoaFF95_EqZN3ntKwiGuOnR67hLPLAxFyX8JLO2CaYlZ6-VAyOHJT …  #Cnn #Irans #Conflict #Iran #American #Follow #Geopolitics",dataset/twitter_images/451e5bdd.jpg,"Live updates: Iran war news, US and Iran race to find crew member from downed F-15 jet - CNN Shared Via InSnaps App: credibletechnologies.in/a/L_9YnRB4tH9E brtMqyFRKoJ1T_sHeSe0uxH7qPRBoNePoaFF95_EqZN3ntKwiGuOnR67hLPLAxFyX8JLO2CaYlZ6-VAyOHJT … #Cnn #Irans #Conflict #Iran #American #Follow #Geopolitics"
105c5fe5,Twitter,"US-Israel-Iran war update Trump ka bada bayan, America jaldi Iran se bahar aa sakta hai, White House signals de raha hai lekin ground pe conflict abhi bhi intense hai, situation tense bani hui hai #trump #iran #usa #israel #war #whitehouse #breaking #news #worldnews #geopolitics",dataset/twitter_images/105c5fe5.jpg,"US-Israel-Iran war update Trump ka bada bayan, America jaldi Iran se bahar aa sakta hai, White House signals de raha hai lekin ground pe conflict abhi bhi intense hai, situation tense bani hui hai #trump #iran #usa #israel #war #whitehouse #breaking #news #worldnews #geopolitics"
4a8c53eb,Twitter,"The U.S.–Iran war enters week six after two U.S. warplanes were downed and a missing pilot search intensifies — fighting spreads and ceasefire hopes fade.   With tensions escalating, is a wider Middle East conflict now inevitable? #WorldNews #Geopolitics #MiddleEast",dataset/twitter_images/4a8c53eb.jpg,"The U.S.–Iran war enters week six after two U.S. warplanes were downed and a missing pilot search intensifies — fighting spreads and ceasefire hopes fade. With tensions escalating, is a wider Middle East conflict now inevitable? #WorldNews #Geopolitics #MiddleEast"
5955333d,Twitter,"BREAKING    Reports say US proposed a 48-hour truce, but Iran rejected it amid escalating conflict. A major setback for Washington as tensions rise and diplomacy fails to gain ground in the region.   #Iran #US #BreakingNews #Geopolitics #War",dataset/twitter_images/5955333d.jpg,"BREAKING Reports say US proposed a 48-hour truce, but Iran rejected it amid escalating conflict. A major setback for Washington as tensions rise and diplomacy fails to gain ground in the region. #Iran #US #BreakingNews #Geopolitics #War"
fb72642e,Twitter, BREAKING: Iran War Update US fighter jet shot down  Rescue mission still ongoing  War cost rising rapidly  Is this a turning point in the conflict?   Watch full analysis  Retweet |  Comment #IranWar #BreakingNews #USvsIran #WarUpdate #Geopolitics,dataset/twitter_images/fb72642e.jpg,BREAKING: Iran War Update US fighter jet shot down Rescue mission still ongoing War cost rising rapidly Is this a turning point in the conflict? Watch full analysis Retweet | Comment #IranWar #BreakingNews #USvsIran #WarUpdate #Geopolitics
c7fcf821,Twitter,"Europe and Asia are bearing the brunt of the ongoing conflict, as global oil and gas supplies are plunged into turmoil  Marco Carnelos  @MarcoCarnelos   Iran war: Why US allies are suffering more than its enemies   https:// braveneweurope.com/marco-carnelos -iran-war-why-us-allies-are-suffering-more-than-its-enemies …  #Geopolitics #Economics #IranWar‌ #Oil",dataset/twitter_images/c7fcf821.jpg,"Europe and Asia are bearing the brunt of the ongoing conflict, as global oil and gas supplies are plunged into turmoil Marco Carnelos Iran war: Why US allies are suffering more than its enemies braveneweurope.com/marco-carnelos -iran-war-why-us-allies-are-suffering-more-than-its-enemies … #Geopolitics #Economics #IranWar‌ #Oil"
d6aa7111,Twitter,Could a conflict between Israel and Iran escalate to nuclear war? This provocative analysis examines the potential for catastrophic fallout and the geopolitical stakes involved. Watch the full breakdown here. #Geopolitics #MiddleEast #NuclearWar #BreakingNews #ForeignPolicy,dataset/twitter_images/d6aa7111.jpg,Could a conflict between Israel and Iran escalate to nuclear war? This provocative analysis examines the potential for catastrophic fallout and the geopolitical stakes involved. Watch the full breakdown here. #Geopolitics #MiddleEast #NuclearWar #BreakingNews #ForeignPolicy
86a356cd,Twitter,Market's furious reaction to escalating war. Bitcoin's nosedive after Trump's statements highlights the chaos. Frustration mounts with unreliable news and prolonged conflict. #MarketVolatility #Bitcoin #Geopolitics,dataset/twitter_images/86a356cd.jpg,Market's furious reaction to escalating war. Bitcoin's nosedive after Trump's statements highlights the chaos. Frustration mounts with unreliable news and prolonged conflict. #MarketVolatility #Bitcoin #Geopolitics
0866e596,Twitter,"As one war potentially ends and another potentially begins, the market reacts. A personal stance against conflict, plus a major cyberattack linked to North Korea. Complex times. #Geopolitics #MarketAnalysis #CyberSecurity",dataset/twitter_images/0866e596.jpg,"As one war potentially ends and another potentially begins, the market reacts. A personal stance against conflict, plus a major cyberattack linked to North Korea. Complex times. #Geopolitics #MarketAnalysis #CyberSecurity"
28fe45ac,Twitter,#USA #Iran #War #Thread Global Chaos What It Really Means for Crypto Markets (April 2026 Deep Dive) As a Crypto Analyst tracking macro  geopolitics & on chain flows 24/7  the ongoing US Israel Iran #conflict now in its 5th week is the biggest driver of short term volatility,dataset/twitter_images/28fe45ac.jpg,#USA #Iran #War #Thread Global Chaos What It Really Means for Crypto Markets (April 2026 Deep Dive) As a Crypto Analyst tracking macro geopolitics & on chain flows 24/7 the ongoing US Israel Iran #conflict now in its 5th week is the biggest driver of short term volatility
6061f1ce,Twitter,"2026 is shaping up as a year of rising global tensions. From the Russia–Ukraine war to friction involving the U.S., Israel, and Iran, the world remains on edge. In South Asia, a limited India–Pakistan conflict is also a  very high possibility. #Geopolitics  #GlobalTensions",dataset/twitter_images/6061f1ce.jpg,"2026 is shaping up as a year of rising global tensions. From the Russia–Ukraine war to friction involving the U.S., Israel, and Iran, the world remains on edge. In South Asia, a limited India–Pakistan conflict is also a very high possibility. #Geopolitics #GlobalTensions"
5a5e32f4,Twitter,Trump saying Israel will stop “when I stop” isn’t just rhetoric — it exposes the real power structure.    It becomes a US-directed conflict with Israel as the operational face.  Which begs the question:  Are we witnessing defense… or delegation of war?  #Geopolitics #MiddleEast,dataset/twitter_images/5a5e32f4.jpg,Trump saying Israel will stop “when I stop” isn’t just rhetoric — it exposes the real power structure. It becomes a US-directed conflict with Israel as the operational face. Which begs the question: Are we witnessing defense… or delegation of war? #Geopolitics #MiddleEast
211c4cd0,Twitter,"US stocks surge on hopes of Iran conflict ending. US Sec. of State says war is nearing its end, but Israel vows to continue military ops against Iran. #geopolitics #stocks",dataset/twitter_images/211c4cd0.jpg,"US stocks surge on hopes of Iran conflict ending. US Sec. of State says war is nearing its end, but Israel vows to continue military ops against Iran. #geopolitics #stocks"
9059e2ac,Twitter,"US stocks surge on hopes of Iran conflict ending. Trump declares US-Israeli war against Iran ""nearing completion"" despite global economic chaos. #economy #geopolitics",dataset/twitter_images/9059e2ac.jpg,"US stocks surge on hopes of Iran conflict ending. Trump declares US-Israeli war against Iran ""nearing completion"" despite global economic chaos. #economy #geopolitics"
5858aa5d,Twitter,ایران جنگ رکوانے میں کردار ادا کرنے کو تیار ہیں ویلادیمیر پوٹن  https:// mazaj.com.pk/urdu/?p=95464 #VladimirPutin #Russia #Iran #War #MiddleEast #BreakingNews #WorldNews #Geopolitics #PeaceTalks #Diplomacy #GlobalTensions #RussiaUkraine #Conflict #NewsUpdate #InternationalNews,dataset/twitter_images/5858aa5d.jpg,ایران جنگ رکوانے میں کردار ادا کرنے کو تیار ہیں ویلادیمیر پوٹن mazaj.com.pk/urdu/?p=95464 #VladimirPutin #Russia #Iran #War #MiddleEast #BreakingNews #WorldNews #Geopolitics #PeaceTalks #Diplomacy #GlobalTensions #RussiaUkraine #Conflict #NewsUpdate #InternationalNews
1c9b4a16,Twitter," Iran mobilizes forces, fortifies Strait of Hormuz islands, preps for asymmetric war vs. U.S. threat. Strategy aims to prolong conflict, raise regional risks. Could impact oil markets, global stability.  #Geopolitics #Oil #Iran",dataset/twitter_images/1c9b4a16.jpg,"Iran mobilizes forces, fortifies Strait of Hormuz islands, preps for asymmetric war vs. U.S. threat. Strategy aims to prolong conflict, raise regional risks. Could impact oil markets, global stability. #Geopolitics #Oil #Iran"
9ada25ac,Twitter,"According to recent research, whenever two countries go to war, the biggest impact is felt by three countries: the two involved in the conflict — and the third is Pakistan. #Pakistan #PMPakistan #GlobalImpact #Geopolitics #petrol #furry #shahbazsharif",dataset/twitter_images/9ada25ac.jpg,"According to recent research, whenever two countries go to war, the biggest impact is felt by three countries: the two involved in the conflict — and the third is Pakistan. #Pakistan #PMPakistan #GlobalImpact #Geopolitics #petrol #furry #shahbazsharif"
1b9af9ba,Twitter,"Iran War Expands As Chechen Fighters Threaten Entry, Raising Fears of Multi-Front Conflict Watch:  https:// youtu.be/6QCbUNkjFHc #IranWar #Hezbollah #Houthis #ChechenFighters #RamzanKadyrov #MiddleEastCrisis #BreakingNews #Geopolitics #WorldNews",dataset/twitter_images/1b9af9ba.jpg,"Iran War Expands As Chechen Fighters Threaten Entry, Raising Fears of Multi-Front Conflict Watch: youtu.be/6QCbUNkjFHc #IranWar #Hezbollah #Houthis #ChechenFighters #RamzanKadyrov #MiddleEastCrisis #BreakingNews #Geopolitics #WorldNews"
79505afe,Twitter,One man’s ego  One region on fire  The entire world paying the price  The Iran–US war isn’t just a conflict… It’s a global shockwave  #usirantensions #Geopolitics #WorldNews #Iran #Usa #amazon,dataset/twitter_images/79505afe.jpg,One man’s ego One region on fire The entire world paying the price The Iran–US war isn’t just a conflict… It’s a global shockwave #usirantensions #Geopolitics #WorldNews #Iran #Usa #amazon
6de93770,Twitter,"Trump claims US could end Iran war in weeks after 'crushing' Iran. Pentagon says next days crucial for Iran conflict, with US 'fighting and talking'. Reports of Iran urging Houthis for new ops heat up Bab el-Mandeb Strait. #Geopolitics",dataset/twitter_images/6de93770.jpg,"Trump claims US could end Iran war in weeks after 'crushing' Iran. Pentagon says next days crucial for Iran conflict, with US 'fighting and talking'. Reports of Iran urging Houthis for new ops heat up Bab el-Mandeb Strait. #Geopolitics"
